{
  "schema": "ophiolite.feature-set/1",
  "representation": "normalized",
  "source": {
    "authority": "ophiolite:uploaded",
    "key": "synthetic-feature-set",
    "revision": "26c66c9fa30d2077262e218ee9108f84264bdaf0846a75443b601b5ec5974bcc",
    "profile": "geojson/1"
  },
  "source_sha256": "26c66c9fa30d2077262e218ee9108f84264bdaf0846a75443b601b5ec5974bcc",
  "interpretation": {
    "reader": "asset_connectors.feature_files/1",
    "mapping": "feature-set/1",
    "parsing_policy": "typed-strict/1",
    "null_policy": "empty cell or declared NODATA value is missing; never zero-filled"
  },
  "context": {
    "crs": "EPSG:23031",
    "xy_unit": "unknown",
    "z_unit": "unknown",
    "z_meaning": "unknown",
    "positive": "unknown",
    "vertical_datum": "unknown",
    "type": "feature-set",
    "axes": "easting-northing",
    "encoding": "utf-8",
    "count": 2,
    "vertex_count": 4,
    "geometry_types": [
      "Polygon"
    ],
    "has_z": false,
    "null_geometry_count": 1,
    "x_range": [
      547895.5,
      554184.5
    ],
    "y_range": [
      5818925.0,
      5824973.0
    ],
    "z_range": null,
    "fields": [
      {
        "name": "FIELD_CODE",
        "source_name": "FIELD_CODE",
        "kind": "text"
      },
      {
        "name": "FIELD_NAME",
        "source_name": "FIELD_NAME",
        "kind": "text"
      },
      {
        "name": "WELLS",
        "source_name": "WELLS",
        "kind": "integer"
      }
    ],
    "fidelity": {
      "status": "assessed",
      "preserved": [
        "every feature in file order with its coordinates",
        "property values of text, number and true/false kinds"
      ],
      "losses": [],
      "unknown_context": [
        "positive",
        "vertical_datum",
        "xy_unit",
        "z_meaning",
        "z_unit"
      ],
      "decisions": [
        "Coordinate system EPSG:23031, as the file's crs member states (a member RFC 7946 removed; read as the older GeoJSON form)."
      ]
    }
  },
  "features": [
    {
      "index": 0,
      "geometry": {
        "type": "Polygon",
        "coordinates": [
          [
            [
              547895.5,
              5818925.0
            ],
            [
              554184.5,
              5818925.0
            ],
            [
              554184.5,
              5824973.0
            ],
            [
              547895.5,
              5818925.0
            ]
          ]
        ]
      },
      "properties": {
        "FIELD_CODE": "HORIZON",
        "FIELD_NAME": "Horizon",
        "WELLS": 3
      }
    },
    {
      "index": 1,
      "geometry": null,
      "properties": {
        "FIELD_CODE": "SPG",
        "FIELD_NAME": "Sprang",
        "WELLS": null
      }
    }
  ]
}
